id,xcoord,ycoord,bng_N,bng_E,venueSize,gigName,locationName,billing,headlineArtist,date,year,month,day,time
0,-0.1409236,51.518032,181593.94,528975.2,-1,"Oasis at London Regent Street Polytechnic, Large Hall (April 19, 1992)","London, UK",,,1992-04-19,1992,4,19,null
1,-2.11667,53.55,405964.84,392270.84,-1,"Oasis at Hippodrome (April 20, 1992)","Oldham, UK",,,1992-04-20,1992,4,20,null
2,-2.11667,53.55,405964.84,392270.84,-1,"Oasis at Club 57 (May 5, 1992)","Oldham, UK",,,1992-05-05,1992,5,5,null
3,-2.235,53.477,397863.8,384404.94,-1,"Oasis at The Boardwalk (July 14, 1992)","Manchester, UK",,,1992-07-14,1992,7,14,null
4,-2.235,53.477,397863.8,384404.94,-1,"Oasis at The Boardwalk (August 19, 1992)","Manchester, UK",,,1992-08-19,1992,8,19,null
5,-2.235,53.477,397863.8,384404.94,-1,"Oasis at The Venue (September 13, 1992)","Manchester, UK",,,1992-09-13,1992,9,13,null
6,-2.235,53.477,397863.8,384404.94,-1,"Oasis at The Boardwalk (November 22, 1992)","Manchester, UK",,,1992-11-22,1992,11,22,null
7,-2.235,53.477,397863.8,384404.94,-1,"Oasis at The Boardwalk (January 5, 1993)","Manchester, UK",,,1993-01-05,1993,1,5,null
8,-2.979,53.402,389941.6,334918.0,-1,"Oasis at La Bateu (March 1, 1993)","Liverpool, UK",,,1993-03-01,1993,3,1,null
9,-2.979,53.402,389941.6,334918.0,-1,"Oasis at Krazy House (April 1, 1993)","Liverpool, UK",,,1993-04-01,1993,4,1,null
10,-2.235,53.477,397863.8,384404.94,-1,"Oasis at The Boardwalk (May 1, 1993)","Manchester, UK",,,1993-05-01,1993,5,1,null
11,-4.2653494,55.8625,665576.56,258241.28,300,"Oasis at King Tut's Wah Wah Hut (May 31, 1993)","Glasgow, UK",,,1993-05-31,1993,5,31,null
12,-2.23149,53.464108,396428.9,384633.22,-1,"Oasis at The Hop & Grape University of Manchester (June 1, 1993)","Manchester, UK",,,1993-06-01,1993,6,1,null
13,-2.979,53.402,389941.6,334918.0,-1,"Oasis at La Bateu (July 1, 1993)","Liverpool, UK",,,1993-07-01,1993,7,1,null
14,-2.235,53.477,397863.8,384404.94,-1,"Oasis at The Boardwalk (July 3, 1993)","Manchester, UK",,,1993-07-03,1993,7,3,null
15,-1.5398636,53.798473,433698.38,430304.22,-1,"Oasis at Duchess of York (September 11, 1993)","Leeds, UK",,,1993-09-11,1993,9,11,null
16,-2.235,53.477,397863.8,384404.94,-1,"Oasis at Canal Bar (September 14, 1993)","Manchester, UK",,,1993-09-14,1993,9,14,null
17,-2.23149,53.464108,396428.9,384633.22,-1,"Liz Phair and Oasis at The Hop & Grape University of Manchester (October 7, 1993)","Manchester, UK",,,1993-10-07,1993,10,7,null
18,-2.23149,53.464108,396428.9,384633.22,-1,"Oasis at The Hop & Grape University of Manchester (October 14, 1993)","Manchester, UK",,,1993-10-14,1993,10,14,null
19,-2.23149,53.464108,396428.9,384633.22,450,"Milltown Brothers with The Real People and Oasis at Manchester Academy 3 (October 14, 1993)","Manchester, UK",,,1993-10-14,1993,10,14,null
20,-2.2620878,53.00721,345612.12,382415.84,1100,"Oasis at Keele University Student Union (October 27, 1993)","Keele, UK",,,1993-10-27,1993,10,27,null
21,-1.4912771,53.381065,387286.6,433835.84,-1,"Oasis at University of Sheffield (October 28, 1993)","Sheffield, UK",,,1993-10-28,1993,10,28,null
22,-1.4826803,52.923294,336371.22,434775.53,-1,"Oasis at Wherehouse (November 1, 1993)","Derby, UK",,,1993-11-01,1993,11,1,null
23,-2.1299286,52.586216,298761.62,391198.16,1200,"Oasis at Wulfrun Hall (November 3, 1993)","Wolverhampton, UK",,,1993-11-03,1993,11,3,null
24,-0.1064525,51.53331,183354.17,531322.5,-1,"Oasis at Powerhaus (November 4, 1993)","London, UK",,,1993-11-04,1993,11,4,null
25,-1.4912771,53.381065,387286.6,433835.84,-1,"Oasis at University of Sheffield (November 28, 1993)","Sheffield, UK",,,1993-11-28,1993,11,28,null
26,-1.8875484,52.475746,286472.56,407637.03,1500,"St. Etienne and Oasis at The Institute (December 1, 1993)","Birmingham, UK",,,1993-12-01,1993,12,1,null
27,-4.247,55.86,665261.06,259380.3,-1,"Oasis at Plaza (December 2, 1993)","Glasgow, UK",,,1993-12-02,1993,12,2,null
28,-1.5606456,52.37614,275479.22,429905.53,-1,"Oasis at University of Warwick Student Union (December 4, 1993)","Coventry, UK",,,1993-12-04,1993,12,4,null
29,-2.1299286,52.586216,298761.62,391198.16,1200,"The Verve and Oasis at Wulfrun Hall (December 8, 1993)","Wolverhampton, UK",,,1993-12-08,1993,12,8,null
30,-2.23149,53.464108,396428.9,384633.22,-1,"Oasis at The Hop & Grape University of Manchester (December 9, 1993)","Manchester, UK",,,1993-12-09,1993,12,9,null
31,-4.2570133,55.85869,665135.5,258749.03,-1,"The Verve and Oasis at Cathouse (December 10, 1993)","Glasgow, UK",,,1993-12-10,1993,12,10,null
32,-2.701,53.757,429214.44,353787.38,-1,"The Verve and Oasis at Mill (December 11, 1993)","Preston, UK",,,1993-12-11,1993,12,11,null
33,-1.6038477,54.972137,564251.44,425356.3,-1,"The Verve and Oasis at Riverside 1 (December 13, 1993)","Newcastle Upon Tyne, UK",,,1993-12-13,1993,12,13,null
34,-1.752,53.796,433353.6,416334.1,-1,"Oasis at Kings Hall (December 14, 1993)","Bradford, UK",,,1993-12-14,1993,12,14,null
35,-2.979,53.402,389941.6,334918.0,-1,"Oasis at Krazy House (December 16, 1993)","Liverpool, UK",,,1993-12-16,1993,12,16,null
36,-0.119524,51.528957,182847.02,530428.5,250,"Oasis with Orange Deluxe and Cream Soda at The Water Rats (January 27, 1994)","London, UK",,,1994-01-27,1994,1,27,null
37,-3.71526,56.2942,712622.2,293853.44,-1,"Oasis at Gleneagles (February 6, 1994)","Auchterarder, UK",,,1994-02-06,1994,2,6,null
38,-0.4666546,52.13597,249785.73,504932.62,-1,"Oasis at The Angel (March 23, 1994)","Bedford, UK",,,1994-03-23,1994,3,23,null
39,-0.1351725,51.516098,181389.14,529379.6,350,"Oasis with Whiteout at 100 Club (March 24, 1994)","London, UK",,,1994-03-24,1994,3,24,null
40,0.283333,51.1333,139652.16,559736.8,-1,"Oasis and Whiteout at The Forum (March 26, 1994)","Tunbridge Wells, UK",,,1994-03-26,1994,3,26,null
41,-1.2295461,51.75517,206607.78,453174.66,-1,"Oasis at Oxford Brookes University Student Union (March 27, 1994)","Oxford, UK",,,1994-03-27,1994,3,27,null
42,-1.8890387,52.451,283720.12,407540.03,-1,"Oasis at The Jug of Ale (March 28, 1994)","Birmingham, UK",,,1994-03-28,1994,3,28,null
43,-2.589343,51.45231,172811.73,359053.5,400,"Oasis at The Fleece (March 30, 1994)","Bristol, UK",,,1994-03-30,1994,3,30,null
44,-2.3626993,51.384743,165196.1,374763.06,220,"Oasis at Moles Club (March 31, 1994)","Bath, UK",,,1994-03-31,1994,3,31,null
45,-2.96667,56.5,734623.44,340498.44,-1,"Oasis at Lucifer's Mill (April 5, 1994)","Dundee, UK",,,1994-04-05,1994,4,5,null
46,-3.1890717,55.948532,673469.25,325750.84,-1,"Oasis at La Belle Angele (April 6, 1994)","Edinburgh, UK",,,1994-04-06,1994,4,6,null
47,-4.267532,55.840775,663164.3,258025.56,-1,"Oasis at Tramway (April 7, 1994)","Glasgow, UK",,,1994-04-07,1994,4,7,null
48,-1.2519926,54.572166,519934.06,448351.62,-1,"Oasis at Middlesbrough Arena (April 8, 1994)","Middlesbrough, UK",,,1994-04-08,1994,4,8,null
49,-2.1858006,53.004383,345281.66,387533.3,-1,"Oasis at Wheatsheaf (April 11, 1994)","Stoke On Trent, UK",,,1994-04-11,1994,4,11,null
50,-1.5398636,53.798473,433698.38,430304.22,-1,"Oasis at Duchess of York (April 12, 1994)","Leeds, UK",,,1994-04-12,1994,4,12,null
51,-2.9868503,53.40777,390590.38,334405.03,-1,"Oasis at Lomax 1 (April 13, 1994)","Liverpool, UK",,,1994-04-13,1994,4,13,null
52,-0.3552462,53.76238,430839.97,508410.97,-1,"Oasis at The Adelphi / New Adelphi (April 29, 1994)","Hull, UK",,,1994-04-29,1994,4,29,null
53,-1.5063632,52.408897,279146.34,433575.47,-1,"Oasis at Coventry University (April 30, 1994)","Coventry, UK",,,1994-04-30,1994,4,30,null
54,-1.075723,50.786644,99034.484,465146.34,-1,"Oasis at Wedgewood Rooms (May 2, 1994)","Southsea, UK",,,1994-05-02,1994,5,2,null
55,-2.9910324,51.590847,188518.53,331353.97,-1,"Oasis at TJ's (May 3, 1994)","Newport, UK",,,1994-05-03,1994,5,3,null
56,-1.4826803,52.923294,336371.22,434775.53,-1,"Oasis at Wherehouse (May 4, 1994)","Derby, UK",,,1994-05-04,1994,5,4,null
57,-1.1377037,52.631897,304183.44,458353.8,-1,"Oasis at Princess Charlotte (May 6, 1994)","Leicester, UK",,,1994-05-06,1994,5,6,null
58,-0.6,51.4833,177022.66,497201.84,-1,"Oasis at Old Trout (May 7, 1994)","Windsor, UK",,,1994-05-07,1994,5,7,null
59,-0.8992343,52.239994,260817.12,475155.0,-1,"Oasis at Roadmender (May 8, 1994)","Northampton, UK",,,1994-05-08,1994,5,8,null
60,0.4799279,51.727863,206200.94,571250.0,-1,"Oasis at Army & Navy Pub (May 10, 1994)","Chelmsford, UK",,,1994-05-10,1994,5,10,null
61,0.19,52.176,255389.77,549731.0,-1,"Oasis at The Boat Race (May 11, 1994)","Cambridge, UK",,,1994-05-11,1994,5,11,null
62,-0.128,51.5078,180479.5,529900.8,-1,"Shed Seven and Oasis with Cast at New Cross (May 13, 1994)","London, UK",,,1994-05-13,1994,5,13,null
63,-1.4648403,53.376324,386772.2,435598.12,900,"Oasis at The Leadmill (May 14, 1994)","Sheffield, UK",,,1994-05-14,1994,5,14,null
64,-1.9017591,52.476963,286606.34,406671.72,-1,"Oasis at Edward No. 8 (June 1, 1994)","Birmingham, UK",,,1994-06-01,1994,6,1,null
65,-3.1771,51.478,176160.92,318264.06,-1,"Oasis at Cardiff University (June 2, 1994)","Cardiff, UK",,,1994-06-02,1994,6,2,null
66,0.0813206,51.56035,186714.17,544258.25,-1,"Oasis at The Island (June 3, 1994)","Ilford, UK",,,1994-06-03,1994,6,3,null
67,-0.1781517,51.500786,179611.34,526440.44,5544,"Stephen Duffy, The Jazz Butcher, The Jesus and Mary Chain, Oasis, and 5 more… at Royal Albert Hall (June 4, 1994)","London, UK",,,1994-06-04,1994,6,4,null
68,1.2878587,52.631435,308858.53,622470.25,290,"Oasis at Norwich Arts Centre (June 6, 1994)","Norwich, UK",,,1994-06-06,1994,6,6,null
69,-0.1296387,51.51391,181155.55,529769.75,-1,"Oasis with Strangelove at Marquee Club - Charing Cross Road (June 8, 1994)","London, UK",,,1994-06-08,1994,6,8,null
70,-2.23149,53.464108,396428.9,384633.22,-1,"Cast and Oasis at The Hop & Grape University of Manchester (June 9, 1994)","Manchester, UK",,,1994-06-09,1994,6,9,null
71,-2.701,53.757,429214.44,353787.38,-1,heineken music festival 1994,"Preston, UK",,,1994-06-09,1994,6,9,null
72,-4.2570133,55.85869,665135.5,258749.03,-1,"Oasis at Cathouse (June 12, 1994)","Glasgow, UK",,,1994-06-12,1994,6,12,null
73,-4.2570133,55.85869,665135.5,258749.03,-1,"Oasis at Cathouse (June 13, 1994)","Glasgow, UK",,,1994-06-13,1994,6,13,null
74,-0.1473792,50.821262,104112.125,530479.44,-1,"Oasis at East Wing Centre (June 18, 1994)","Brighton, UK",,,1994-06-18,1994,6,18,null
75,-2.587,51.1663,141007.0,358961.97,-1,Glastonbury Festival 1994,"Pilton, UK",,,1994-06-24,1994,6,24,null
76,-4.247,55.86,665261.06,259380.3,-1,T In The Park 1994,"Glasgow, UK",,,1994-07-30,1994,7,30,null
77,-4.053679,55.777634,655721.4,271204.7,-1,T In The Park 1994,"Hamilton, UK",,,1994-07-31,1994,7,31,null
78,-1.6038477,54.972137,564251.44,425356.3,-1,"Oasis at Riverside 1 (August 9, 1994)","Newcastle Upon Tyne, UK",,,1994-08-09,1994,8,9,null
79,-1.5065974,53.799652,433844.16,432494.16,-1,"Oasis at Leeds Irish Centre (August 10, 1994)","Leeds, UK",,,1994-08-10,1994,8,10,null
80,-2.1299286,52.586216,298761.62,391198.16,1200,"Oasis at Wulfrun Hall (August 11, 1994)","Wolverhampton, UK",,,1994-08-11,1994,8,11,null
81,-1.1535941,52.955887,340206.6,456854.47,2000,"Oasis at Rock City (August 15, 1994)","Nottingham, UK",,,1994-08-15,1994,8,15,null
82,-0.141771,51.552048,185374.97,528820.3,2350,"Oasis with Ocean Colour Scene at The Forum (August 16, 1994)","London, UK",,,1994-08-16,1994,8,16,null
83,-0.1304708,51.515884,181373.95,529706.4,2000,"Oasis with Ocean Colour Scene at Astoria (August 18, 1994)","London, UK",,,1994-08-18,1994,8,18,null
84,-3.074116,53.167538,363952.7,328203.12,-1,"Oasis at Tivoli (August 31, 1994)","Buckley, UK",,,1994-08-31,1994,8,31,null
85,-5.930742,54.593197,529119.8,146108.69,-1,"Oasis at Limelight (September 4, 1994)","Belfast, UK",,,1994-09-04,1994,9,4,null
86,-2.2475262,53.474308,397567.25,383572.62,-1,"Oasis at Haçienda (September 5, 1994)","Manchester, UK",,,1994-09-05,1994,9,5,null
87,-1.4055136,50.907608,112245.66,441793.5,1749,"Oasis at O2 Guildhall Southampton (November 30, 1994)","Southampton, UK",,,1994-11-30,1994,11,30,null
88,-1.4912771,53.381065,387286.6,433835.84,-1,"Oasis at Octagon Centre, University of Sheffield (December 1, 1994)","Sheffield, UK",,,1994-12-01,1994,12,1,null
89,0.1194611,52.20439,258403.69,544816.44,1800,"Oasis at Corn Exchange Cambridge (December 4, 1994)","Cambridge, UK",,,1994-12-04,1994,12,4,19:00:00
90,-4.2369184,55.855057,664690.9,259993.33,1900,"Oasis at Barrowland Ballroom (December 7, 1994)","Glasgow, UK",,,1994-12-07,1994,12,7,null
91,-2.1299286,52.586216,298761.62,391198.16,4000,"Oasis at The Civic Hall (December 11, 1994)","Wolverhampton, UK",,,1994-12-11,1994,12,11,null
92,-3.1762128,51.481976,176601.97,318332.78,-1,"Oasis at Vision 2k (December 12, 1994)","Cardiff, UK",,,1994-12-12,1994,12,12,null
93,-0.2239576,51.493904,178768.05,523280.2,-1,"Oasis at Hammersmith Palais (December 13, 1994)","London, UK",,,1994-12-13,1994,12,13,null
94,-2.9813228,53.407375,390541.25,334771.8,-1,"Oasis at Royal Court Theatre (December 17, 1994)","Liverpool, UK",,,1994-12-17,1994,12,17,null
95,-2.23149,53.464108,396428.9,384633.22,1500,"Oasis at Manchester Academy (December 18, 1994)","Manchester, UK",,,1994-12-18,1994,12,18,null
96,-4.2369184,55.855057,664690.9,259993.33,1900,"Oasis at Barrowland Ballroom (December 27, 1994)","Glasgow, UK",,,1994-12-27,1994,12,27,null
97,-0.1488263,50.82128,104111.836,530377.44,-1,"Oasis with Ride and The La's at Brighton Centre (December 29, 1994)","Brighton, UK",,,1994-12-29,1994,12,29,null
98,-1.2350084,54.57475,520233.2,449446.34,-1,"Oasis at Middlesbrough Town Hall (December 30, 1994)","Middlesbrough, UK",,,1994-12-30,1994,12,30,null
99,0.6910414,51.5372,185519.88,586607.1,-1,"Oasis with The Verve at Cliffs Pavilion (April 17, 1995)","Westcliff-on-sea, UK",,,1995-04-17,1995,4,17,null
100,-1.4168171,53.400543,389491.4,438770.53,13500,"Oasis with Pulp at Motorpoint Arena (April 22, 1995)","Sheffield, UK",,,1995-04-22,1995,4,22,null
101,-1.1377037,52.631897,304183.44,458353.8,-1,"Oasis at Princess Charlotte (May 5, 1995)","Leicester, UK",,,1995-05-05,1995,5,5,null
102,-2.3526983,51.380913,164766.61,375456.88,-1,"Oasis at Bath Pavilion (June 22, 1995)","Bath, UK",,,1995-06-22,1995,6,22,null
103,-2.54677,51.1897,143586.97,361793.8,-1,Glastonbury Festival 1995,"Shepton Mallet, UK",,,1995-06-23,1995,6,23,null
104,-4.66667,55.6,637271.4,232010.14,-1,"Oasis with The Verve at Irvine Beach (July 14, 1995)","Irvine, UK",,,1995-07-14,1995,7,14,null
105,-4.66667,55.6,637271.4,232010.14,-1,"Oasis at Irvine Beach (July 15, 1995)","Irvine, UK",,,1995-07-15,1995,7,15,null
106,-2.172,53.026,347683.9,388465.06,-1,"Oasis at Trentham Gardens (September 14, 1995)","Stoke On Trent, UK",,,1995-09-14,1995,9,14,null
107,-0.128,51.5078,180479.5,529900.8,-1,"Oasis at Virgin Megastore (October 1, 1995)","London, UK",,,1995-10-01,1995,10,1,null
108,-3.05,53.8167,436139.0,330878.8,-1,"Oasis at Empress Ballroom (October 2, 1995)","Blackpool, UK",,,1995-10-02,1995,10,2,null
109,-2.172,53.026,347683.9,388465.06,-1,"Oasis at Trentham Gardens (October 3, 1995)","Stoke On Trent, UK",,,1995-10-03,1995,10,3,null
110,-1.8791888,50.71766,90963.87,408527.8,-1,"Oasis with Smaller at Bournemouth International Centre (October 5, 1995)","Bournemouth, UK",,,1995-10-05,1995,10,5,null
111,-2.25,51.8333,215045.8,382775.34,-1,"Oasis with Smaller at Gloucester Leisure Centre (October 6, 1995)","Gloucester, UK",,,1995-10-06,1995,10,6,null
112,-0.1965816,51.490677,178455.64,525189.1,19000,"Oasis with Bootleg Beatles at Earls Court (November 4, 1995)","London, UK",,,1995-11-04,1995,11,4,null
113,-0.1965816,51.490677,178455.64,525189.1,19000,"Oasis with Bootleg Beatles at Earls Court (November 5, 1995)","London, UK",,,1995-11-05,1995,11,5,null
114,-1.128,52.634,304424.9,459007.62,-1,"Oasis at Granby Halls (November 17, 1995)","Leicester, UK",,,1995-11-17,1995,11,17,null
115,-1.611,54.973,564344.94,424898.0,-1,"Oasis with Ocean Colour Scene at Whitley Bay Ice Rink (November 25, 1995)","Newcastle Upon Tyne, UK",,,1995-11-25,1995,11,25,null
116,-2.235,53.477,397863.8,384404.94,-1,"Oasis with Chemical Brothers at NYNEX Arena (November 26, 1995)","Manchester, UK",,,1995-11-26,1995,11,26,null
117,-1.451299,55.04639,572579.44,435055.5,-1,"Oasis at Ice Rink (January 19, 1996)","Whitley Bay, UK",,,1996-01-19,1996,1,19,null
118,-3.188,55.952,673853.9,325824.38,-1,"Oasis with Ocean Colour Scene at Ingliston Exhibition Centre (January 21, 1996)","Edinburgh, UK",,,1996-01-21,1996,1,21,null
119,-3.188,55.952,673853.9,325824.38,-1,"Oasis with Ocean Colour Scene at Ingliston Exhibition Centre (January 22, 1996)","Edinburgh, UK",,,1996-01-22,1996,1,22,null
120,-3.1726308,51.478806,176245.6,318575.84,7500,"Oasis at Motorpoint Arena Cardiff (March 18, 1996)","Cardiff, UK",,,1996-03-18,1996,3,18,null
121,-3.1726308,51.478806,176245.6,318575.84,7500,"Oasis with Manic Street Preachers at Motorpoint Arena Cardiff (March 19, 1996)","Cardiff, UK",,,1996-03-19,1996,3,19,null
122,-2.235,53.477,397863.8,384404.94,-1,"Oasis with Manic Street Preachers and Ocean Colour Scene at Maine Road (April 27, 1996)","Manchester, UK",,,1996-04-27,1996,4,27,null
123,-2.2354121,53.4539,395294.28,384369.1,-1,"Oasis with Manic Street Preachers and Ocean Colour Scene at Manchester City Football Club (April 28, 1996)","Manchester, UK",,,1996-04-28,1996,4,28,null
124,-0.2,51.8667,220261.58,523920.94,-1,"Oasis with The Prodigy, Ocean Colour Scene, Chemical Brothers, and 1 more… at Knebworth Castle (August 10, 1996)","Knebworth, UK",,,1996-08-10,1996,8,10,null
125,-0.2106344,51.877506,221445.42,523159.3,-1,"Oasis with The Prodigy, Manic Street Preachers, Ocean Colour Scene, and 2 more… at Knebworth Park (August 10, 1996)","Knebworth, UK",,,1996-08-10,1996,8,10,null
126,-0.2106344,51.877506,221445.42,523159.3,-1,"Oasis with Manic Street Preachers, The Charlatans, Cast, and 2 more… at Knebworth Park (August 11, 1996)","Knebworth, UK",,,1996-08-11,1996,8,11,null
127,-0.117448,51.5034,180008.84,530645.56,-1,"Oasis at Royal Festival Hall, Southbank Centre (August 23, 1996)","London, UK",,,1996-08-23,1996,8,23,null
128,-3.44087,50.70878,90959.664,298275.0,-1,"Oasis at Westpoint Arena (September 13, 1997)","Exeter, UK",,,1997-09-13,1997,9,13,null
129,-3.44087,50.70878,90959.664,298275.0,-1,"Oasis at Westpoint Arena (September 14, 1997)","Exeter, UK",,,1997-09-14,1997,9,14,null
130,-1.624028,54.963074,563235.8,424070.06,-1,"Oasis with Travis at Newcastle Arena (September 16, 1997)","Newcastle Upon Tyne, UK",,,1997-09-16,1997,9,16,null
131,-1.624028,54.963074,563235.8,424070.06,-1,"Oasis at Metro Radio Arena (September 17, 1997)","Newcastle Upon Tyne, UK",,,1997-09-17,1997,9,17,null
132,-2.11,57.1526,806845.94,393345.75,-1,"Oasis with Travis at Aberdeen Exhibition & Conference Centre (September 19, 1997)","Aberdeen, UK",,,1997-09-19,1997,9,19,null
133,-2.11,57.1526,806845.94,393345.75,-1,"Oasis at Aberdeen Exhibition & Conference Centre (September 20, 1997)","Aberdeen, UK",,,1997-09-20,1997,9,20,null
134,-1.4168171,53.400543,389491.4,438770.53,13500,"Oasis with Travis at Motorpoint Arena (September 22, 1997)","Sheffield, UK",,,1997-09-22,1997,9,22,null
135,-1.4168171,53.400543,389491.4,438770.53,13500,"Oasis at Motorpoint Arena (September 23, 1997)","Sheffield, UK",,,1997-09-23,1997,9,23,null
136,-0.1965816,51.490677,178455.64,525189.1,19000,"Oasis with The Verve at Earls Court (September 25, 1997)","London, UK",,,1997-09-25,1997,9,25,null
137,-0.1965816,51.490677,178455.64,525189.1,19000,"Oasis with The Verve at Earls Court (September 26, 1997)","London, UK",,,1997-09-26,1997,9,26,null
138,-0.1965816,51.490677,178455.64,525189.1,19000,"Oasis with The Verve at Earls Court (September 27, 1997)","London, UK",,,1997-09-27,1997,9,27,null
139,-1.9187133,52.48265,287237.75,405519.62,-1,"Oasis with Travis at National Indoor Arena (September 29, 1997)","Birmingham, UK",,,1997-09-29,1997,9,29,null
140,-1.9187133,52.48265,287237.75,405519.62,-1,"Oasis with Travis at National Indoor Arena (September 30, 1997)","Birmingham, UK",,,1997-09-30,1997,9,30,null
141,-0.1965816,51.490677,178455.64,525189.1,19000,"Oasis with Bootleg Beatles at Earls Court (November 4, 1997)","London, UK",,,1997-11-04,1997,11,4,null
142,-0.1965816,51.490677,178455.64,525189.1,19000,"Oasis at Earls Court (November 26, 1997)","London, UK",,,1997-11-26,1997,11,26,null
143,-4.2809606,55.860603,665397.9,257257.62,-1,"Oasis at Scottish Exhibition and Conference Centre (December 7, 1997)","Glasgow, UK",,,1997-12-07,1997,12,7,null
144,-4.2809606,55.860603,665397.9,257257.62,-1,"Oasis at Scottish Exhibition and Conference Centre (December 8, 1997)","Glasgow, UK",,,1997-12-08,1997,12,8,null
145,-3.1771,51.478,176160.92,318264.06,-1,"Oasis with Travis at Cardiff Indoor Arena (December 10, 1997)","Cardiff, UK",,,1997-12-10,1997,12,10,null
146,-3.1771,51.478,176160.92,318264.06,-1,"Oasis at Cardiff Indoor Arena (December 11, 1997)","Cardiff, UK",,,1997-12-11,1997,12,11,null
147,-2.3037128,53.39997,389312.12,379808.56,-1,"Oasis at Manchester Central (GMEX) (December 13, 1997)","Manchester, UK",,,1997-12-13,1997,12,13,null
148,-2.3037128,53.39997,389312.12,379808.56,-1,"Oasis at Manchester Central (GMEX) (December 14, 1997)","Manchester, UK",,,1997-12-14,1997,12,14,null
149,-0.2827842,51.5577,185764.45,519030.62,12500,"Oasis with Supergrass at Wembley Arena (December 16, 1997)","London, UK",,,1997-12-16,1997,12,16,null
150,-0.2827842,51.5577,185764.45,519030.62,12500,"Oasis with Supergrass at Wembley Arena (December 17, 1997)","London, UK",,,1997-12-17,1997,12,17,null
151,-0.2827842,51.5577,185764.45,519030.62,12500,"Oasis with Supergrass at Wembley Arena (December 18, 1997)","London, UK",,,1997-12-18,1997,12,18,null
152,-3.4229,56.20613,702409.94,311741.78,17000,T In The Park 2000,"Kinross, UK",,,2000-07-08,2000,7,8,null
153,-2.43333,53.5833,409750.6,371315.38,-1,"Oasis with Happy Mondays and Johnny Marr & The Healers at Reebok Stadium (July 15, 2000)","Bolton, UK",,,2000-07-15,2000,7,15,null
154,-2.43333,53.5833,409750.6,371315.38,-1,"Oasis with Happy Mondays at Reebok Stadium (July 16, 2000)","Bolton, UK",,,2000-07-16,2000,7,16,null
155,-0.128,51.5078,180479.5,529900.8,105000,"Oasis with Happy Mondays and Doves at Wembley Stadium (July 21, 2000)","London, UK",,,2000-07-21,2000,7,21,null
156,-0.128,51.5078,180479.5,529900.8,105000,"Oasis with Doves and Happy Mondays at Wembley Stadium (July 22, 2000)","London, UK",,,2000-07-22,2000,7,22,null
157,-3.235843,55.943424,672951.94,322820.3,-1,"Oasis with Happy Mondays and Doves at Murrayfield Stadium (July 29, 2000)","Edinburgh, UK",,,2000-07-29,2000,7,29,null
158,-0.969,51.454,173339.06,471628.8,-1,Reading Festival 2000,"Reading, UK",,,2000-08-25,2000,8,25,null
159,-4.247,55.86,665261.06,259380.3,-1,Glasgow Green Festival 2000,"Glasgow, UK",,,2000-08-25,2000,8,25,null
160,-4.238972,55.854347,664616.0,259862.25,-1,Glasgow Green Festival 2000,"Glasgow, UK",,,2000-08-25,2000,8,25,null
161,-1.548,53.797,433531.12,429769.4,-1,Leeds Festival 2000,"Leeds, UK",,,2000-08-26,2000,8,26,null
162,-0.2238407,51.503506,179836.06,523262.38,2000,"Oasis with The Music at O2 Shepherd's Bush Empire (October 7, 2001)","London, UK",,,2001-10-07,2001,10,7,null
163,-2.206175,53.460663,396040.47,386312.56,7000,"Oasis with The Music at O2 Apollo Manchester (October 10, 2001)","Manchester, UK",,,2001-10-10,2001,10,10,null
164,-2.206175,53.460663,396040.47,386312.56,7000,"Oasis at O2 Apollo Manchester (October 11, 2001)","Manchester, UK",,,2001-10-11,2001,10,11,null
165,-4.2369184,55.855057,664690.9,259993.33,1900,"Oasis at Barrowland Ballroom (October 13, 2001)","Glasgow, UK",,,2001-10-13,2001,10,13,null
166,-4.2369184,55.855057,664690.9,259993.33,1900,"Oasis with Burn at Barrowland Ballroom (October 14, 2001)","Glasgow, UK",,,2001-10-14,2001,10,14,null
167,-0.4026708,51.6592,196862.6,510474.38,-1,"Oasis at Watford Colosseum (February 5, 2002)","Watford, UK",,,2002-02-05,2002,2,5,null
168,-0.1781517,51.500786,179611.34,526440.44,5544,"Oasis with Black Rebel Motorcycle Club and Richard Ashcroft at Royal Albert Hall (February 6, 2002)","London, UK",,,2002-02-06,2002,2,6,null
169,-0.4026708,51.6592,196862.6,510474.38,-1,"Oasis at Watford Colosseum (February 8, 2002)","Watford, UK",,,2002-02-08,2002,2,8,null
170,-5.915621,54.60381,530244.94,147150.64,-1,"Oasis at Odyssey Arena (June 29, 2002)","Belfast, UK",,,2002-06-29,2002,6,29,null
171,-5.915621,54.60381,530244.94,147150.64,-1,"Oasis at Odyssey Arena (June 30, 2002)","Belfast, UK",,,2002-06-30,2002,6,30,null
172,-0.3413888,53.73894,428254.16,509385.2,-1,"Oasis at Hull Arena (July 2, 2002)","Hull, UK",,,2002-07-02,2002,7,2,null
173,-0.3413888,53.73894,428254.16,509385.2,-1,"Oasis with The Soundtrack Of Our Lives at Hull Arena (July 3, 2002)","Hull, UK",,,2002-07-03,2002,7,3,null
174,-0.128,51.5078,180479.5,529900.8,-1,"Oasis with The Charlatans, Black Rebel Motorcycle Club, The Coral, and 2 more… at Finsbury Park (July 5, 2002)","London, UK",,,2002-07-05,2002,7,5,null
175,-0.128,51.5078,180479.5,529900.8,-1,"Oasis with Black Rebel Motorcycle Club, The Charlatans, The Coral, and 2 more… at Finsbury Park (July 6, 2002)","London, UK",,,2002-07-06,2002,7,6,null
176,-0.128,51.5078,180479.5,529900.8,-1,finsbury park festival 2002,"London, UK",,,2002-07-06,2002,7,6,null
177,-0.128,51.5078,180479.5,529900.8,-1,"Oasis with Black Rebel Motorcycle Club, The Charlatans, The Coral, and 2 more… at Finsbury Park (July 7, 2002)","London, UK",,,2002-07-07,2002,7,7,null
178,-1.611,54.973,564344.94,424898.0,-1,"Oasis at Telewest Arena (July 10, 2002)","Newcastle Upon Tyne, UK",,,2002-07-10,2002,7,10,null
179,-1.611,54.973,564344.94,424898.0,-1,"Oasis at Telewest Arena (July 11, 2002)","Newcastle Upon Tyne, UK",,,2002-07-11,2002,7,11,null
180,-3.42677,56.2075,702567.2,311504.88,-1,T In The Park 2002,"Kinross, UK",,,2002-07-13,2002,7,13,null
181,-2.11,57.1526,806845.94,393345.75,-1,"Oasis at Aberdeen Exhibition & Conference Centre (September 9, 2002)","Aberdeen, UK",,,2002-09-09,2002,9,9,null
